CSA-LITE-0019,EU iBorderCtrl Automated Border Deception Detection,iBorderCtrl EU,2019,2019,Hungary,Central Europe,eu_member_state,AIAAIC,https://euobserver.com/digital/146535;https://www.europarl.europa.eu/doceo/document/E-9-2019-002793_EN.html,,2,EU Observer journalism; European Parliament written question; academic critique; limited official consortium documentation,automated_decision_system,automated deception detection via avatar interview,"National border authorities of Hungary, Latvia, and Greece",border_or_migration_authority,,true,piloted,Third-country nationals crossing EU land borders at pilot sites,Pilot at 3 border crossing points; limited numbers of travellers,Project consortium documentation; EU Observer reporting,migration_asylum_border_control,Automated deception detection pre-screening for border crossers,direct,high,Directly maps to Annex III migration: risk assessment tool used at EU external borders for third-country nationals,EU-funded Horizon 2020 pilot; deployed in Hungary at EU external border,2,Border crossing denial affects migration status and access to EU; life-altering for affected individuals,medium,1,Deception detection score informs but border officer formally decides on crossing permission,medium,2,Third-country nationals seeking border entry including migrants and asylum seekers; heightened vulnerability,high,1,Border officer reviews and makes final decision but trained to rely on system output,medium,2,No mechanism to challenge deception detection score; only final border decision challengeable,high,0,Pilot at limited border crossing points only; very small scale,high,2,Underlying deception detection model not disclosed; scientific validity of automated lie detection widely contested,high,1,EU-funded project had academic consortium oversight; some peer review published; project reports partially available,medium,iBorderCtrl used an AI avatar to conduct pre-screening interviews with travellers at EU external borders and scored responses for deception indicators. The project was funded by the EU Horizon 2020 programme. Academic researchers and the European Digital Rights network criticised the scientific basis for automated deception detection as lacking empirical validity.,EU Horizon 2020 funded research project; scientific validity of automated deception detection strongly contested; project concluded 2019 without full deployment,Scientific consensus that automated deception detection via facial expressions is unreliable; project consortium disputed this; pilot outcomes not published,,2026-05-27,11,high,8,0,0.83,11,11,11,high,high,high,False,True,False,True,0.2.0
CSA-LITE-0020,Schufa Automated Credit Scoring ECJ Case,Schufa Credit Score,2023,1997,Germany,Western Europe,eu_member_state,AIAAIC,https://curia.europa.eu/juris/document/document.jsf?text=&docid=280426;https://www.bundesgerichtshof.de/SharedDocs/Pressemitteilungen/EN/2024/2024008.html,,4,ECJ Grand Chamber ruling with full reasoning; German Federal Supreme Court ruling; academic legal analysis,scoring_system,proprietary credit scoring algorithm,Schufa Holding AG,financial_institution,Schufa Holding AG,false,litigated,German residents and credit applicants; virtually all adult population with credit history,Virtually all German credit decisions; tens of millions of credit records,Schufa stated customer base; ECJ proceedings,essential_services_benefits,Automated credit scoring determining access to credit and financial services,direct,high,Directly maps to Annex III essential services: automated scoring for credit access affecting basic financial services,EU member state deployment; ECJ ruling Dec 2023 establishes GDPR Art.22 requirements applicable,2,"Credit score determines access to housing credit, loans, and financial services; consequential for livelihood",high,2,Automated score used by banks without individual human review before credit decision,high,1,Credit applicants in asymmetric financial institutional context with limited recourse,medium,2,No human review of Schufa score before bank uses it to deny credit; fully automated outcome,high,1,GDPR Art.22 rights established by ECJ; complaint and correction mechanism exists but complex,medium,2,National German deployment affecting virtually all adult credit decisions,high,2,Calculation methodology never disclosed; trade secret protection claimed; ECJ found GDPR Art.22 applies requiring disclosure sufficient for meaningful challenge,high,1,ECJ ruling 2023 established requirements; German data protection authority investigations conducted; monitoring improving,medium,The ECJ ruled in December 2023 that automated Schufa credit scores constitute automated individual decision-making under GDPR Art.22 and that individuals have the right to human review. Schufa had refused to disclose its scoring methodology citing trade secrets. The German Federal Supreme Court applied the ruling in 2024.,Landmark GDPR Art.22 ruling on automated credit scoring; Schufa required to disclose sufficient information for meaningful review; ongoing compliance proceedings,Exact Schufa algorithm features still partially undisclosed post-ruling; extent of compliance with ECJ judgment under active assessment by German DPA,,2026-05-27,13,severe,8,0,0.8725,13,13,13,severe,severe,severe,False,False,False,False,0.2.0
CSA-LITE-0021,UK DWP Universal Credit Fraud Detection AI,UK UC Fraud AI,2020,2019,United Kingdom,Western Europe,united_kingdom,AIAAIC,https://www.nao.org.uk/reports/managing-fraud-and-error-in-universal-credit/;https://www.childpovertyactiongroup.org.uk/policy-advocacy-funding/benefits/universal-credit/uc-and-fraud-error,,3,NAO audit report; Child Poverty Action Group policy documentation; parliamentary written answers; journalism,fraud_detection,undisclosed machine learning fraud detection,Department for Work and Pensions,welfare_or_social_service_agency,,false,deployed,Universal Credit claimants; approximately 6 million people in the UK,All Universal Credit claimants; 6 million as of 2023,DWP administrative statistics; NAO report,essential_services_benefits,Automated fraud detection triggering benefit investigations and potential suspension,direct,high,Directly maps to Annex III essential services: automated fraud detection affecting welfare benefit access,UK deployment; outside EU AI Act scope; Annex III mapping is analytical reference only,2,Benefit suspension and fraud investigations affect welfare access; consequential for individuals with no other income,high,2,Automated flags trigger investigations and benefit suspensions; claimants often not informed of basis,high,2,"Universal Credit claimants including disabled, unemployed, and low-income individuals; high vulnerability",high,1,DWP case managers nominally review flagged cases but resource constraints limit individual review quality,medium,1,Mandatory reconsideration process exists but complex and slow; significant delays documented,medium,2,National deployment covering all 6 million UC claimants,high,2,Fraud detection criteria not disclosed; DWP has not published algorithm details,high,2,No published monitoring; concerns raised by NAO and CPAG; systematic external evaluation not conducted,high,The DWP's fraud and error detection systems for Universal Credit use automated analytics to flag suspected fraud. The NAO reported significant fraud and error in the system. Child Poverty Action Group and NGOs documented cases where legitimate claimants had benefits suspended based on undisclosed algorithmic flags without meaningful explanation.,NAO audit found significant fraud and error; DWP has not published fraud detection methodology; parliamentary scrutiny ongoing,Specific algorithm details entirely undisclosed; extent to which ML versus rule-based detection used not clarified; false positive rate unknown,,2026-05-27,14,severe,8,0,0.915,14,14,14,severe,severe,severe,False,False,False,False,0.2.0
CSA-LITE-0022,Meta Facebook Content Amplification Algorithm,Meta FB Algorithm,2021,2009,United States,North America,united_states,AIAAIC,https://www.wsj.com/articles/facebook-knows-instagram-is-toxic-for-teen-girls-company-documents-show-11631620739;https://whistleblower.aid.org/resources/facebook-papers/,,3,Wall Street Journal Facebook Papers investigation; Frances Haugen whistleblower documents; Congressional testimony; academic studies,recommender_or_allocation_system,engagement-maximising recommendation algorithm,Meta Platforms Inc.,platform,Meta Platforms Inc.,false,reported_incident,Facebook and Instagram users globally; particular documented harm to adolescent users,Approximately 3 billion monthly active users,Meta published user statistics,non_annex_comparator,Content recommendation algorithm; no direct Annex III analogue as social media platform,comparator,medium,Social media content amplification does not fall within current Annex III enumeration; mapped as non-Annex comparator for reference,US-domiciled platform; EU DSA applies as lex specialis for content amplification systemic risk assessment,1,Content amplification influences information environment; consequential for democratic discourse and mental health but not individual access to essential services,medium,2,Fully automated content ranking with no human review of individual amplification decisions,high,1,General adult population; documented specific risks for adolescent users and those with mental health vulnerabilities,medium,1,Oversight Board exists with limited scope; no systematic human review of amplification decisions,medium,1,Users can control some settings and report content; limited transparency into ranking algorithm,medium,2,3 billion+ users globally; largest social media platform by users,high,2,Ranking algorithm features entirely proprietary; Frances Haugen leaked documents showing internal awareness of harm while maintaining algorithm unchanged,high,2,Frances Haugen whistleblower 2021 disclosed internal documents; no systematic monitoring; harms documented externally not internally,high,Frances Haugen disclosed internal Meta documents to the Wall Street Journal in September 2021 showing that Meta's own research found Instagram caused body image and mental health harms to teenage girls. Internal documents showed Meta prioritised engagement metrics over harm reduction. Congressional hearings followed.,Subject to EU DSA enforcement investigations; FTC investigation; multiple Congressional hearings; Meta disputed characterisation of internal documents,Causal relationship between amplification algorithm and documented harms versus other factors is contested in academic literature,,2026-05-27,12,severe,8,0,0.83,12,12,12,severe,severe,severe,False,False,False,False,0.2.0
CSA-LITE-0023,Twitter Algorithmic Image Cropping Racial Bias,Twitter Image Crop,2020,2018,United States,North America,united_states,AIID,https://arxiv.org/abs/2105.08667;https://blog.twitter.com/engineering/en_us/topics/insights/2021/sharing-learnings-about-our-image-cropping-algorithm,,3,Twitter official blog post acknowledging findings; peer-reviewed academic analysis; journalism; Twitter own published audit,automated_decision_system,saliency-based image cropping neural network,Twitter Inc.,platform,Twitter Inc.,false,withdrawn,Twitter users who post images; audiences whose faces may be cropped in preview,350 million+ users globally,Twitter user statistics,non_annex_comparator,Aesthetic image cropping algorithm; no direct Annex III analogue,comparator,high,Social media image cropping does not fall within Annex III enumeration; mapped as comparator for reference,US-domiciled platform; EU DSA framework relevant for systemic risk assessment,0,"Cropping selects preview frame in image; no material impact on individual rights, welfare, or access to essential services",high,2,Fully automated without any human review of individual cropping decisions,high,0,General adult population with no particular vulnerability in this context,high,0,Twitter monitored and investigated after external disclosure; algorithm subsequently discontinued,high,1,Users could view full image; platform setting adjustment possible; limited but non-zero recourse,medium,2,350 million+ users globally; very large scale,high,1,Algorithm discontinued after public disclosure; mechanism partially documented in Twitter published audit,medium,1,Twitter conducted own audit after external disclosure and published results; blog post and academic study published,high,Researchers found that Twitter's neural network image cropping algorithm systematically favoured white faces over Black faces in preview crops. Twitter conducted its own analysis confirming the finding and published results. Twitter subsequently discontinued the algorithmic saliency-based crop in 2021 in favour of showing full images.,Low-harm case; company responded with disclosure and product change; useful as reference comparator for low-criticality automated system with appropriate response,Precise mechanism of racial bias in saliency model not fully explained in Twitter published audit,,2026-05-27,7,moderate,8,0,0.915,7,7,7,moderate,moderate,moderate,False,False,False,False,0.2.0
CSA-LITE-0024,Palantir Gotham Chicago Police Department,Palantir Chicago PD,2017,2012,United States,North America,united_states,AIAAIC,https://igchicago.org/wp-content/uploads/2020/04/OIG-CPD-Strategic-Subject-List-Assessment.pdf;https://www.chicagoreader.com/chicago/chicago-police-palantir-predictive-policing/Content?oid=68276478,,3,Chicago Inspector General assessment; Chicago Reader investigation; court settlement documents; journalism,predictive_model,data fusion and pattern analysis,Chicago Police Department,law_enforcement_agency,Palantir Technologies,false,deployed,Residents in surveillance databases; communities subject to algorithmically directed policing,Citywide deployment in Chicago; approximately 2.7 million residents in covered areas,CPD stated deployment scope; OIG report,law_enforcement,Data fusion and pattern analysis directing law enforcement investigations and resource allocation,direct,high,Directly maps to Annex III law enforcement: AI system directing law enforcement resource allocation and investigations,US deployment; Annex III mapping is analytical reference only,1,Influences police resource allocation and investigative focus; indirect effect on individuals in database,medium,1,Informs officer and investigative decisions; officers formally retain discretion over individual actions,medium,1,Residents in targeted communities; documented disparate impact on minority communities,medium,1,Officers nominally review recommendations; OIG found insufficient oversight of system itself,medium,2,Individuals in database not informed; no mechanism to challenge inclusion or targeting,high,2,Citywide deployment in third-largest US city; significant scale,high,2,Palantir contract terms not initially disclosed; Chicago settled lawsuit requiring some disclosure; algorithm features partially disclosed after settlement,medium,1,Chicago OIG conducted assessment 2020; partial disclosure following settlement; monitoring not comprehensive,medium,The Chicago OIG's 2020 assessment of the Strategic Subject List powered by Palantir found insufficient oversight and no evidence of effectiveness in reducing violence. CPD maintained a list of individuals predicted to be involved in gun violence. Following public disclosure CPD discontinued the list.,CPD discontinued Strategic Subject List 2020 following OIG assessment and advocacy; Palantir contract terms disclosed via FOIA litigation,Extent to which Palantir Gotham versus the Strategic Subject List itself caused harm is operationally difficult to separate,,2026-05-27,11,high,8,0,0.745,11,11,11,high,high,high,False,False,False,False,0.2.0
CSA-LITE-0025,New York City Pre-Trial Risk Assessment Instrument,NYC Pre-Trial RAI,2017,2001,United States,North America,united_states,AIID,https://criminaljustice.cityofnewyork.us/wp-content/uploads/2020/10/AI-Innovation-Update-2020.pdf;https://www.nycja.org/what-we-do/pretrial-services/risk-assessment/,,3,NYC Office of Criminal Justice publications; NYC Criminal Justice Agency documentation; academic analyses; journalism,risk_assessment,logistic regression risk model,New York City Criminal Justice Agency,public_authority,New York City Criminal Justice Agency,false,deployed,Pre-trial defendants in New York City courts,Approximately 300000 arraignments per year in NYC,NYC Criminal Justice Agency annual reports,law_enforcement,Pre-trial risk assessment informing bail and detention decisions,direct,high,Directly maps to Annex III law enforcement: risk assessment tool informing criminal pre-trial detention decisions,US deployment; Annex III mapping is analytical reference only,2,Pre-trial detention affects liberty; bail decisions have significant material and social consequences,high,1,Score informs judicial bail decision; judges formally decide but documented influence on outcomes,high,2,Criminal defendants including low-income individuals who cannot afford bail regardless of risk level,high,1,Judges formally review but limited ability to assess algorithmic basis; pre-trial hearings are brief,medium,1,Standard pre-trial legal representation available; risk assessment tool partially documented,medium,2,Citywide deployment for all NYC arraignments; approximately 300000 per year,high,1,NYC Criminal Justice Agency has published PSA tool documentation; features and weights partially disclosed,medium,1,NYC Office of Criminal Justice conducts periodic reviews; published innovation update 2020,medium,New York City's pre-trial risk assessment has been used since 2001 to inform bail decisions at arraignment. The tool is administered by the NYC Criminal Justice Agency. Advocates have documented racial disparities in outcomes notwithstanding use of risk scores.,NYC RAI more transparent than many peer tools with published documentation; reforms under 2019 New York bail law changed landscape,Causal role of risk tool versus judge discretion in racial disparities in bail outcomes contested,,2026-05-27,11,high,8,0,0.83,11,11,11,high,high,high,False,False,False,False,0.2.0
CSA-LITE-0026,HunchLab Predictive Policing Philadelphia,HunchLab Philadelphia,2016,2015,United States,North America,united_states,AIAAIC,https://www.aclu.org/report/big-data-big-problems-predictive-policing-and-civil-rights;https://techcrunch.com/2017/07/17/azavea-hunchlab/,,2,ACLU policy report; journalism; academic critique; vendor documentation; limited official police documentation,predictive_model,machine learning crime prediction,Philadelphia Police Department,law_enforcement_agency,Azavea Inc.,false,withdrawn,Residents in algorithmically predicted high-risk areas; communities subject to directed patrols,Philadelphia police jurisdiction; city-scale deployment,ACLU documentation; vendor stated deployment,law_enforcement,Location-based crime prediction directing police patrol deployment,direct,high,Directly maps to Annex III law enforcement: AI system directing police patrol resource allocation,US deployment; Annex III mapping is analytical reference only,1,Location predictions influence patrol deployment; indirect effect on community members stopped or searched,medium,1,Algorithm informs patrol officers; officers retain discretion over individual stops and interactions,medium,1,Residents in targeted areas; documented racially disparate impact consistent with predictive policing literature,medium,1,Officers nominally retain discretion; no formal oversight of the algorithmic prediction itself,medium,2,Community members have no recourse for being in a targeted patrol area,high,1,City-scale Philadelphia deployment; significant urban deployment,high,2,Proprietary Azavea model; algorithm features not publicly disclosed,high,2,No monitoring; Philadelphia discontinued after academic critique and advocacy; Azavea stopped selling to police 2020,high,Azavea's HunchLab system predicted crime hot spots for Philadelphia police patrol deployment. Azavea discontinued sales of HunchLab to law enforcement in 2020 following internal ethics review and external advocacy. The decision was cited as an example of a tech company voluntarily exiting the predictive policing market.,Azavea notably exited police predictive policing market voluntarily; company published public statement on decision,Difficult to assess effectiveness or harm relative to other policing practices; Azavea voluntary exit limits further study,,2026-05-27,11,high,8,0,0.83,11,11,11,high,high,high,False,True,False,True,0.2.0
CSA-LITE-0027,NHS Babylon GP at Hand AI Triage,NHS Babylon Health,2018,2017,United Kingdom,Western Europe,united_kingdom,AIAAIC,https://www.bmj.com/content/364/bmj.l1099;https://www.digitalhealth.net/2018/09/babylon-health-faces-scrutiny-over-triage-ai/,,3,BMJ investigation; NHS England documentation; Babylon Health peer response; academic clinical evaluation,other,clinical natural language processing chatbot,Babylon Health and NHS GP practices,healthcare_provider,Babylon Health,true,deployed,NHS patients using GP at Hand digital service; predominantly young healthy urban users,Approximately 80000 registered patients at peak,NHS England GP registration data,non_annex_comparator,AI-driven symptom checking and triage for GP appointments; healthcare not enumerated in Annex III,comparator,medium,Healthcare triage AI does not fall within Annex III; mapped as comparator for cross-domain analysis,UK NHS public-private partnership deployment; outside EU AI Act scope,1,Triage recommendations may delay or accelerate care access; consequential but GP review occurs before clinical action,medium,1,AI recommends triage pathway; GP or clinician makes final clinical decision,high,1,Patients seeking medical advice; asymmetric context due to health concerns and clinical knowledge gap,medium,1,GP or clinician reviews before any consequential clinical action; limited ability to assess AI triage logic,medium,0,Standard NHS complaints process available; clinical decisions made by registered practitioners,high,1,NHS partnership deployment; primarily London-based; significant but not national scale,medium,1,Babylon published some clinical validation; BMJ investigation raised concerns; partial transparency,medium,1,BMJ conducted independent clinical evaluation; NHS England oversight; NHS GP registration data tracked,medium,The BMJ investigation found that Babylon Health's symptom checker gave potentially dangerous triage recommendations in some test scenarios including failing to recommend urgent care for symptoms of heart attack. Babylon disputed the findings. NHS England reviewed the partnership. Babylon filed for administration in 2023.,Public-private NHS partnership; BMJ investigation contested by Babylon; company expanded globally before financial difficulties; Babylon filed for administration 2023,Clinical performance of AI triage systems difficult to evaluate without large-scale outcomes data; BMJ methodology contested by Babylon,,2026-05-27,7,moderate,8,0,0.745,7,7,7,moderate,moderate,moderate,False,False,False,False,0.2.0
CSA-LITE-0028,Uber Driver Algorithmic Deactivation,Uber Driver AI,2017,2014,United States,North America,multi_jurisdiction,AIAAIC,https://fortune.com/2020/08/07/uber-lyft-driver-algorithm-deactivation/;https://www.theguardian.com/technology/2020/aug/24/uber-lyft-drivers-deactivated-without-warning-algorithm,,3,Fortune and Guardian reporting with driver testimony; UK employment tribunal proceedings; academic gig economy research,automated_decision_system,behavioural scoring and deactivation algorithm,Uber Technologies Inc.,platform,Uber Technologies Inc.,false,deployed,Gig worker drivers dependent on platform income,More than 3.5 million drivers in the US alone; global deployment,Uber stated driver numbers; academic gig economy estimates,employment_worker_management,Automated driver account deactivation based on ratings and performance metrics,direct,high,Directly maps to Annex III employment: automated system making employment access decisions for gig workers,US-domiciled platform; UK Supreme Court found workers are employees; EU Platform Work Directive relevant to EU deployments,2,Deactivation eliminates gig worker income; consequential for those with platform income dependency,high,2,Automated deactivation with no individual human review before action in most cases,high,1,Gig workers in asymmetric platform relationship with limited institutional protections,medium,1,Some appeals process described in driver terms; human review of some appeals but limited transparency,medium,1,Appeals process exists but limited transparency; deactivation criteria not disclosed; inconsistency reported by workers,medium,2,Global deployment across 3.5 million US drivers alone; one of largest gig economy platforms,high,2,Deactivation criteria not disclosed; ratings aggregation methodology hidden; drivers cannot understand basis for deactivation,high,2,No monitoring; deactivation harms documented by worker advocacy groups and academic gig economy researchers,high,"Uber's algorithm automatically deactivates driver accounts based on low ratings, acceptance rates, and other metrics without prior warning or individual human review. Drivers report receiving deactivation notices without explanation. UK employment tribunals found that the opacity of algorithmic management constitutes a power imbalance requiring employment protections.",UK Supreme Court 2021 ruled Uber drivers are workers entitled to employment rights; EU Platform Work Directive seeks algorithmic transparency for gig workers; ongoing litigation in multiple jurisdictions,Whether automated deactivation constitutes unfair dismissal under UK employment law varies by case; EU Platform Work Directive implementation pending,,2026-05-27,13,severe,8,0,0.8725,13,13,13,severe,severe,severe,False,False,False,False,0.2.0
