CSA-LITE-0010,Durham Constabulary HART Custody Risk Tool,Durham HART,2017,2017,United Kingdom,Northern Europe,united_kingdom,AIAAIC,https://www.bigbrotherwatch.org.uk/wp-content/uploads/2019/05/Face-Off-campaign-update-FINAL.pdf;https://www.tandfonline.com/doi/full/10.1080/01924036.2019.1589241,,3,Big Brother Watch investigation; peer-reviewed academic publication; custody suite inspection reports,risk_assessment,machine learning risk classifier,Durham Constabulary,law_enforcement_agency,,false,piloted,Custody suspects assessed for detention and release decisions,All custody decisions at Durham Constabulary; approximately 15000 annually,Durham Constabulary stated scale; academic publication,law_enforcement,Risk assessment used in police custody decision-making,direct,high,Directly maps to Annex III law enforcement: risk assessment tool informing custody and detention decisions,UK deployment; Annex III mapping is analytical reference only,2,Custody decisions affect liberty; risk score influences bail and detention outcomes,high,1,Score informs custody decisions; officers formally retain authority but documented influence on decisions,medium,2,Suspects in custody; incarceration context constitutes heightened vulnerability,high,1,Custody officers formally decide; extent of deviation from score in practice unclear,medium,1,Standard pre-trial legal representation available; algorithm not individually disclosed in proceedings,medium,1,Regional deployment within one police force area,high,2,No public documentation of model features or weights; referred to in academic literature only partially,high,1,Big Brother Watch investigation triggered some disclosure; academic review published; partial monitoring,medium,"Durham Constabulary's HART system was described as the first operational AI custody risk tool in the UK. It classified suspects as high, medium, or low risk to inform custody conditions and release decisions. Big Brother Watch and academic researchers raised concerns about transparency and absence of formal legal disclosure.",First known operational police AI risk assessment tool in UK; Big Brother Watch 2019 investigation triggered disclosure; academic paper published details,Exact features used and weights assigned not publicly disclosed; operational status post-2019 not clearly confirmed in public record,,2026-05-27,11,high,8,0,0.83,11,11,11,high,high,high,False,False,False,False,0.2.0
CSA-LITE-0011,France Parcoursup University Admission Algorithm,Parcoursup France,2018,2018,France,Western Europe,eu_member_state,AIAAIC,https://www.legifrance.gouv.fr/jorf/id/JORFTEXT000036428817;https://www.enseignementsup-recherche.gouv.fr/fr/parcoursup-bilan-de-la-session-2023-92697,https://www.lemonde.fr/education/article/2018/06/04/parcoursup-le-conseil-d-etat-rejette-les-recours-contre-l-algorithme_5308897_1473685.html,3,Government legislation and annual reports; Conseil d'Etat ruling; Mediateur de l'Education reports; journalism,ranking_system,multi-criteria ranking algorithm,Ministere de l'Enseignement Superieur,public_authority,,false,deployed,All French baccalaureate students seeking university admission,Approximately 950000 students per year,Ministry annual statistical reports,education_vocational_training,Automated ranking and allocation of university applicants to places,direct,high,Directly maps to Annex III education: AI system determining university access decisions for all French students,EU member state deployment; operated under French law,2,University admission decisions are life-altering educational and career access outcomes,high,1,Algorithm ranks applications; universities nominally make final decisions but capacity constraints make rank near-determinative,high,1,Students in asymmetric institutional context with limited ability to contest algorithm ranking,medium,1,Universities review but capacity constraints make meaningful deviation from algorithm ranking difficult in practice,medium,1,Appeals process exists via Parcoursup platform and academic mediator; limited practical capacity for all appeals,medium,2,National French deployment covering all baccalaureate students seeking university places,high,1,Algorithm source code published after legal challenge in 2018; local university-specific criteria remain partially opaque,medium,1,Annual Ministry reports published; Defenseur des Droits raised equity concerns; ongoing academic monitoring,medium,Parcoursup replaced Admission Post-Bac in 2018 and processes all French university applications. Following legal challenges the algorithm source code was published but critics noted local university grading parameters remained opaque. The Defenseur des Droits raised concerns about equity for students from disadvantaged backgrounds.,Algorithm code published after legal challenge; Conseil d'Etat upheld system 2018; ongoing parliamentary and academic scrutiny of equity outcomes,Local institution-specific ranking criteria partially opaque; interaction between national algorithm and local parameters not fully transparent,,2026-05-27,10,high,8,0,0.7875,10,10,10,high,high,high,False,False,False,False,0.2.0
CSA-LITE-0012,Netherlands Childcare Benefit Algorithm Toeslagenaffaire,NL Toeslagen AI,2019,2013,Netherlands,Western Europe,eu_member_state,AIAAIC,https://www.rijksoverheid.nl/documenten/rapporten/2021/03/12/ongekend-onrecht;https://www.tweedekamer.nl/vergaderingen/commissievergaderingen/details?id=2021A04020,,4,Parliamentary inquiry report Ongekend Onrecht 2021; Tax Authority internal audit; multiple court rulings; journalism,fraud_detection,rule-based fraud detection with ML risk profiling,Dutch Tax and Customs Administration (Belastingdienst),public_authority,,false,withdrawn,Families claiming childcare benefits; disproportionate impact on dual-nationality and non-Western background families,Approximately 26000 families received incorrect debt demands,Parliamentary inquiry; Tax Authority remediation statistics,essential_services_benefits,Automated fraud flagging for childcare benefit claims,direct,high,Directly maps to Annex III essential services: automated fraud detection affecting welfare benefit access,EU member state deployment; landmark case cited in EU AI Act legislative history,2,Wrongful debt demands caused bankruptcy and severe hardship; children placed in care in some cases,high,2,Automated fraud flags and debt recovery demands issued with no individual case review before action,high,2,Families with young children; disproportionate impact on ethnic minority households; some families rendered destitute,high,2,No individual review before demand issuance; parliamentary inquiry found systematic failure of oversight,high,2,Appeals process was dysfunctional; multi-year delays; burden placed on families to prove innocence,high,2,National deployment affecting all Dutch childcare benefit claimants,high,2,Fraud detection criteria not disclosed to affected families; dual nationality used as undisclosed risk factor,high,2,No monitoring; parliamentary inquiry found systematic failures; discovered via sustained journalism and individual casework,high,The Dutch parliamentary inquiry report Ongekend Onrecht found the Tax Authority wrongly labelled approximately 26000 families as fraudsters. The system used dual nationality as an undisclosed risk factor. Prime Minister Rutte's government resigned in January 2021 over the scandal.,Government fell over this case; ongoing remediation with payments to affected families; case cited in EU AI Act legislative debates as motivating example,Exact algorithm features including use of dual nationality as risk factor reconstructed retrospectively; original documentation incomplete,,2026-05-27,16,severe,8,0,1.0,16,16,16,severe,severe,severe,False,False,False,False,0.2.0
CSA-LITE-0013,UK Home Office Visa Streaming Algorithm,UK Visa Streaming,2020,2015,United Kingdom,Western Europe,united_kingdom,AIAAIC,https://www.theguardian.com/uk-news/2020/oct/09/home-office-secretly-used-racial-bias-visa-streaming-tool;https://www.gov.uk/government/publications/visa-decision-making-using-algorithmic-streaming,,4,Freedom of Information responses; Home Office published policy document after litigation; parliamentary questions; Guardian investigation,automated_decision_system,rule-based streaming algorithm,UK Home Office,border_or_migration_authority,,false,withdrawn,Visa applicants; evidence of disparate impact by nationality,All UK visa applications; approximately 3.5 million per year,Home Office statistical releases,migration_asylum_border_control,Automated streaming of visa applications to fast or slow processing tracks,direct,high,Directly maps to Annex III migration: automated processing system affecting visa and immigration decisions,UK deployment outside EU AI Act scope; Annex III mapping is analytical reference only,2,Track assignment affects visa processing time and outcomes; consequential for migration status,high,2,Fully automated track assignment with no individual review of the streaming decision itself,high,2,Visa applicants including economic migrants and asylum seekers; limited recourse in immigration context,high,2,Caseworkers review final applications but the streaming decision itself was not subject to review,high,2,Streaming decision itself not subject to appeal; only final visa decision appealable,high,2,National deployment affecting all UK visa applications; very large scale,high,2,Home Office initially denied tool existed; disclosed only after litigation and FOI requests; algorithm criteria not published,high,2,No monitoring; existence disclosed via litigation by the3million campaign and FOI requests; withdrawn after public disclosure,high,The Home Office visa streaming tool assigned applications to fast or slow processing tracks using nationality-based rules. The Guardian reported the tool disproportionately assigned applications from African and Asian nationalities to slower tracks. The tool was disclosed only through FOI litigation and subsequently withdrawn in 2020.,Home Office initially denied tool existed; disclosed after litigation; algorithm criteria still not fully published; equalities impact assessment published belatedly,Full details of nationality weightings and criteria remain partially undisclosed; extent of individual harm from delayed applications difficult to quantify,,2026-05-27,16,severe,8,0,1.0,16,16,16,severe,severe,severe,False,False,False,False,0.2.0
CSA-LITE-0014,Detroit Police Facial Recognition False Arrest,Detroit Police FRT,2020,2019,United States,North America,united_states,AIID,https://www.aclu.org/news/privacy-technology/wrongfully-accused-by-an-algorithm;https://www.nytimes.com/2020/06/24/technology/facial-recognition-arrest.html,,4,ACLU documentation of Robert Williams case; court records; NYT investigation; ACLU lawsuit documentation,facial_recognition,facial recognition matching,Detroit Police Department,law_enforcement_agency,DataWorks Plus,false,reported_incident,Criminal suspects in Detroit; documented disparate error rates affecting Black individuals,Detroit police jurisdiction; several hundred identification requests per year,ACLU case documentation; DPD stated deployment scale,biometrics,Facial recognition for suspect identification in criminal investigations,direct,high,Directly maps to Annex III biometrics: facial recognition used in law enforcement identification,US deployment; Annex III mapping is analytical reference only,2,False identification can result in wrongful arrest and detention; life-altering consequences for liberty,high,1,Algorithm provides candidate match; detective formally decides to arrest; documented cases of arrest on sole basis of match,high,2,Criminal suspects; documented higher false positive rates for Black individuals; incarceration risk,high,1,Detective reviews match but limited technical capacity to challenge output; Robert Williams case demonstrates inadequate review,high,1,Standard criminal defense available; wrongful arrest can be challenged but only after harm occurs,medium,1,City-scale deployment within Detroit police jurisdiction,high,2,System vendor and specific model not disclosed by DPD; match process not transparent to suspects,high,2,No systematic monitoring; Robert Williams wrongful arrest in 2020 disclosed publicly by ACLU public defender,high,Robert Williams was arrested in January 2020 in front of his family after Detroit Police used facial recognition to match him to a shoplifting suspect. The match was incorrect. Williams was held for 30 hours before release. The ACLU documented this as the first known wrongful arrest by facial recognition in the United States.,ACLU filed lawsuit; Detroit PD subsequently adopted use policies; NIST audit data showing higher error rates for dark-skinned individuals supports accuracy concerns,Exact false positive rates of the specific DPD system not publicly disclosed; only the Williams case is publicly documented as wrongful arrest,,2026-05-27,12,severe,8,0,0.9575,12,12,12,severe,severe,severe,False,False,False,False,0.2.0
CSA-LITE-0015,Clearview AI Facial Recognition Mass Surveillance,Clearview AI,2020,2017,United States,North America,united_states,AIAAIC,https://www.nytimes.com/2020/01/18/technology/clearview-privacy-facial-recognition.html;https://ico.org.uk/about-the-ico/media-centre/news-and-blogs/2022/05/ico-fines-clearview-ai-inc-more-than-7-5-million/,,4,NYT investigation; ICO enforcement decision with full reasoning; CNIL enforcement; Australian Privacy Commissioner investigation,facial_recognition,deep learning facial recognition,Multiple US law enforcement agencies,law_enforcement_agency,Clearview AI Inc.,false,litigated,General public whose images were scraped without consent; individuals identified in law enforcement investigations,More than 3 billion images scraped; over 600 law enforcement clients in US at peak,NYT investigation; ICO decision documents,biometrics,Facial recognition enabling identification of individuals from scraped public internet images,direct,high,Directly maps to Annex III biometrics: large-scale remote biometric identification using scraped internet images,Subject to enforcement by ICO UK and CNIL France; multiple GDPR enforcement actions; under EU AI Act this system type would constitute prohibited practice,2,Law enforcement use enables identification and targeting of individuals; significant liberty implications,high,1,Algorithm provides identification; law enforcement formally decides how to act on matches,high,1,General public has images scraped without consent; law enforcement targets face specific risks,medium,1,Law enforcement nominally reviews matches before acting; limited oversight of company itself,medium,2,Individuals not informed they are in database; no mechanism to contest inclusion or matching,high,2,3 billion image database; 600+ law enforcement clients in US alone; global scale,high,2,Images scraped in violation of website terms of service; no disclosure to individuals; GDPR enforcement fines issued by multiple regulators,high,2,No monitoring; company and database discovered by NYT investigative journalist 2020; regulatory enforcement followed,high,Clearview AI built a facial recognition database of over 3 billion images scraped from social media and websites without consent. The NYT investigation in January 2020 disclosed the company. The ICO fined Clearview GBP 7.5 million in 2022 and ordered data deletion. The CNIL and Australian Privacy Commissioner issued enforcement actions.,"Subject to enforcement by regulators in UK, France, Australia, Canada and Italy; US ACLU litigation; most EU and UK regulatory actions upheld on appeal",Exact number of individuals incorrectly identified by Clearview AI in law enforcement contexts not publicly disclosed,,2026-05-27,13,severe,8,0,0.915,13,13,13,severe,severe,severe,False,False,False,False,0.2.0
CSA-LITE-0016,Arkansas Medicaid Personal Care Algorithm,Arkansas Medicaid AI,2016,2016,United States,North America,united_states,AIID,https://www.aclu.org/cases/ledgerwood-v-pittman;https://law.justia.com/cases/federal/district-courts/arkansas/arwdce/4:2016cv00731/97561/193,,4,Federal court rulings; ACLU litigation records; state agency documentation from discovery; journalism,eligibility_determination,undisclosed algorithmic scoring,Arkansas Department of Human Services,public_authority,,false,litigated,Medicaid recipients with disabilities receiving personal care services,Approximately 8000 Medicaid recipients affected by care hour reductions,ACLU litigation; DHS data from court proceedings,essential_services_benefits,Automated determination of personal care service hours for disabled Medicaid recipients,direct,high,Directly maps to Annex III essential services: automated eligibility determination for essential health and care services,US deployment; Annex III mapping is analytical reference only,2,Care hour reductions directly affected health access and welfare of individuals with disabilities,high,2,Automated calculation of care hours with no individual case review before reduction implemented,high,2,Individuals with physical and intellectual disabilities; elderly Medicaid recipients; heightened vulnerability,high,2,No individual oversight; reductions implemented automatically; state witness unable to explain algorithm outputs in court,high,1,ACLU appeals succeeded in federal court; appeals process existed but required protracted litigation to enforce,medium,1,Statewide deployment in Arkansas,high,2,Algorithm produced unexplained reductions with no methodology documentation; state could not explain outputs in court,high,2,No monitoring; errors discovered when individuals and advocates noticed unexplained reductions; ACLU litigation followed,high,Arkansas deployed an automated algorithm to calculate Medicaid personal care hours for people with disabilities. The algorithm produced dramatic unexplained reductions. In federal court proceedings the state's expert witness was unable to explain why the algorithm produced specific outputs. The Eighth Circuit found the system violated procedural due process.,Eighth Circuit found system violated due process; state revised system following litigation; parallel case in Idaho had similar outcome,Specific algorithm features never publicly disclosed despite litigation; expert could not explain outputs under cross-examination,,2026-05-27,14,severe,8,0,0.9575,14,14,14,severe,severe,severe,False,False,False,False,0.2.0
CSA-LITE-0017,Optum Patient Risk Algorithm Racial Bias,Optum Patient Algo,2019,2013,United States,North America,united_states,AIID,https://www.science.org/doi/10.1126/science.aax2342;https://www.nytimes.com/2019/10/24/health/racial-bias-medical-algorithm.html,,4,Peer-reviewed Science publication by Obermeyer et al.; NYT reporting; Optum public response; academic follow-up studies,scoring_system,commercial algorithmic risk scoring,Multiple US health systems using Optum Humedica,healthcare_provider,Optum (UnitedHealth Group),false,reported_incident,Hospital patients enrolled in care management programs; Black patients disproportionately underserved,Estimated 200 million patients in commercial software using comparable approach,Science paper extrapolation from study dataset,essential_services_benefits,Automated patient risk scoring for health care management program allocation,analogous,high,Analogous to Annex III essential services: automated scoring determining access to health care management resources affecting essential health services,US deployment; Annex III mapping is analytical reference only,2,Care management program allocation affects health outcomes; consequential for chronic disease management,high,2,Automated scoring without individual review; score determines program eligibility,high,2,Patients with complex chronic conditions; documented significant underserving of Black patients,high,1,Clinicians can advocate for patients but have limited visibility into scoring algorithm,medium,1,Standard insurance and hospital appeals available; algorithm not individually disclosed to patients,medium,2,Used across major US health systems; estimated to affect 200 million patients in commercial deployments,high,2,Proprietary Optum algorithm; features not publicly disclosed; racial bias only discovered by external researchers purchasing dataset,high,2,No monitoring; racial bias discovered by Obermeyer et al. Science 2019 via purchased dataset analysis; Optum subsequently modified algorithm,high,"Obermeyer et al. published in Science in 2019 showing that a widely used commercial health algorithm systematically underestimated the care needs of Black patients relative to white patients with the same health status. The algorithm used healthcare cost as a proxy for health need, reproducing existing racial disparities in care access.",Optum acknowledged findings and updated algorithm; paper found Black patients assigned the same risk score as white patients were significantly sicker; estimated 50 per cent reduction in Black patient referrals,Algorithm used cost as health need proxy; whether this constitutes intentional discrimination or emergent proxy bias is legally and scientifically contested,,2026-05-27,14,severe,8,0,0.915,14,14,14,severe,severe,severe,False,False,False,False,0.2.0
CSA-LITE-0018,Houston ISD EVAAS Teacher Evaluation AI,Houston EVAAS,2017,2011,United States,North America,united_states,AIID,https://reason.com/volokh/2017/05/04/houston-teachers-win-due-process-lawsuit/;https://law.justia.com/cases/federal/district-courts/texas/txsdce/4:2014cv03044/1183100/146,,3,Federal court ruling; published court opinions; academic analysis; education reporting,scoring_system,EVAAS value-added model,Houston Independent School District,education_institution,SAS Institute Inc.,false,litigated,Teachers evaluated and terminated based on EVAAS scores,Approximately 12000 teachers in Houston ISD,Court proceedings; HISD administrative records,employment_worker_management,Value-added model for teacher performance evaluation used in hiring and termination decisions,direct,high,Directly maps to Annex III employment: AI system used in performance evaluation affecting employment,US deployment; Annex III mapping is analytical reference only,2,EVAAS scores used for teacher termination; directly affects livelihood and career,high,2,EVAAS scores used as de-facto determinative basis for teacher dismissal in Houston ISD,high,1,Teachers in asymmetric employment relationship with school district,medium,1,Principals formally reviewed but institutional pressure to act on scores documented,medium,2,SAS Institute refused to disclose model; court found teachers had no meaningful opportunity to challenge basis for termination,high,1,Houston ISD only; district-level deployment,high,2,SAS refused to disclose EVAAS model under trade secret protection; court found this violated due process,high,2,No monitoring; teachers discovered termination based on undisclosed algorithm via lawsuit,high,Federal Judge Melinda Harmon ruled in 2017 that Houston ISD's use of the EVAAS teacher evaluation system violated due process because the algorithm was a trade secret and teachers could not meaningfully challenge the basis of their terminations. SAS Institute had refused to disclose the model citing trade secret protection.,Court ruled in favour of teachers; HISD subsequently limited EVAAS use; SAS trade secret argument rejected on due process grounds,Value-added model validity for individual teacher evaluation contested in independent academic psychometric literature,,2026-05-27,13,severe,8,0,0.915,13,13,13,severe,severe,severe,False,False,False,False,0.2.0
